[
  {
    "id": "golden_045",
    "layer": "regression",
    "dimension": "集中度趋势",
    "eval_type": "l3",
    "input": "合成台账/快照的加权集中度达成率",
    "expected": "达成率判定函数输出正确（≥70% 达标）",
    "assertion": "threshold",
    "tolerance": {"attainment_rate_min": 0.70},
    "baseline_value": 0.72,
    "comparison": "trend_better",
    "tags": ["concentration", "regression-baseline"],
    "source": "18号 §7.5 Go/No-Go 闸门"
  },
  {
    "id": "golden_046",
    "layer": "regression",
    "dimension": "集中度趋势",
    "eval_type": "l3",
    "input": "各巷道拣货量已知",
    "expected": "80% 拣货量落 ≤5 巷道计算正确",
    "assertion": "exact",
    "tolerance": {"threshold": 0.8, "n": 5},
    "baseline_value": null,
    "comparison": null,
    "tags": ["concentration"],
    "source": "18号 §1.3 L36"
  },
  {
    "id": "golden_047",
    "layer": "regression",
    "dimension": "集中度趋势",
    "eval_type": "l3",
    "input": "阈值 N 参数化",
    "expected": "weighted_concentration threshold=0.8 时 N 计算正确",
    "assertion": "exact",
    "tolerance": {"threshold": 0.8},
    "baseline_value": null,
    "comparison": null,
    "tags": ["concentration", "threshold"],
    "source": "18号 §1.3 L36"
  },
  {
    "id": "golden_048",
    "layer": "regression",
    "dimension": "集中度趋势",
    "eval_type": "l3",
    "input": "两周集中度对比",
    "expected": "环比向好判定正确",
    "assertion": "semantic",
    "tolerance": {},
    "baseline_value": null,
    "comparison": "trend_better",
    "tags": ["concentration", "trend"],
    "source": "20号 §7.5 趋势向好"
  },
  {
    "id": "golden_050",
    "layer": "regression",
    "dimension": "集中度趋势",
    "eval_type": "l3",
    "input": "期末加权集中度达成率",
    "expected": "达成率 ≥70% 判 Go，<70% 判 No-Go",
    "assertion": "threshold",
    "tolerance": {"attainment_rate_min": 0.70},
    "baseline_value": 0.71,
    "comparison": "no_regression",
    "tags": ["concentration", "go-nogo", "regression-baseline"],
    "source": "20号 §7.5 Go/No-Go 闸门"
  }
]
